{
  "schema_version": 1,
  "t": "2026-10-24T17:50:50Z",
  "league": "epl",
  "game_id": "epl-2026-10-24-chelsea-tottenham",
  "keyframe": false,
  "state": "live",
  "score": { "home": 0, "away": 1 },
  "clock": "64'",
  "quotes": [{ "contract": "total-over-1.5", "venue": "kalshi", "bid": 0.46, "ask": 0.47, "ask_size": 80, "fee": 0.0174 }],
  "gone": [{ "contract": "result-draw", "venue": "polymarket" }]
}
